{"family_id":"family-d02","fixture_id":"dp-development-02","normalized_findings":[{"advisories":[{"advisory_id":"GHSA-xvch-5gv4-984h","severity":"critical"}],"affected_status":"affected","dependency_paths":[{"package_chain":["npm:fixture-root-d02@1.0.0","npm:minimist@1.2.5"],"relationship":"direct","runtime_scope":"development_only","source_key":"path-source-e351d5437c6d"}],"ecosystem":"npm","evidence_references":[{"snippet":"Prototype Pollution in minimist","source_key":"evidence-source-56dc84c64e71","subject_key":"finding-source-65a6244b0dea","subject_type":"finding"}],"installed_version":"1.2.5","package_name":"minimist","reachability":"unknown","remediation_options":[{"affected_status":"unaffected","availability":"available","compatibility":"incompatible","source_key":"option-source-515a7a2d8bc1","target_version":"0.2.4"},{"affected_status":"unaffected","availability":"available","compatibility":"compatible","source_key":"option-source-0adc046370c3","target_version":"1.2.6"}],"source_key":"finding-source-65a6244b0dea"}],"schema_version":1,"split":"development","task_id":"dependency-01f064863e16"}
