{"family_id":"family-r01","fixture_id":"dp-regression-01","normalized_findings":[{"advisories":[{"advisory_id":"GHSA-3h5v-q93c-6h6q","severity":"high"}],"affected_status":"affected","dependency_paths":[{"package_chain":["npm:fixture-root-r01@1.0.0","npm:ws@7.5.9"],"relationship":"direct","runtime_scope":"production","source_key":"path-source-a3cfd7ff4177"}],"ecosystem":"npm","evidence_references":[{"snippet":"ws affected by a DoS when handling a request with many HTTP headers","source_key":"evidence-source-5aaded862ac6","subject_key":"finding-source-681137ba5ba2","subject_type":"finding"}],"installed_version":"7.5.9","package_name":"ws","reachability":"unknown","remediation_options":[{"affected_status":"unaffected","availability":"available","compatibility":"incompatible","source_key":"option-source-36748b6ae8ca","target_version":"5.2.4"},{"affected_status":"unaffected","availability":"available","compatibility":"incompatible","source_key":"option-source-18d4b3ab8625","target_version":"6.2.3"},{"affected_status":"unaffected","availability":"available","compatibility":"compatible","source_key":"option-source-131267a26c66","target_version":"7.5.10"},{"affected_status":"unaffected","availability":"available","compatibility":"incompatible","source_key":"option-source-1d102a5f1a4c","target_version":"8.17.1"}],"source_key":"finding-source-681137ba5ba2"},{"advisories":[{"advisory_id":"GHSA-3h5v-q93c-6h6q","severity":"high"}],"affected_status":"affected","dependency_paths":[{"package_chain":["npm:fixture-root-r01@1.0.0","npm:ws@6.2.2"],"relationship":"direct","runtime_scope":"development_only","source_key":"path-source-ea8b5a372174"}],"ecosystem":"npm","evidence_references":[{"snippet":"ws affected by a DoS when handling a request with many HTTP headers","source_key":"evidence-source-ec94c95ae2b1","subject_key":"finding-source-6f118f32ec11","subject_type":"finding"}],"installed_version":"6.2.2","package_name":"ws","reachability":"unreachable","remediation_options":[{"affected_status":"unaffected","availability":"available","compatibility":"incompatible","source_key":"option-source-5bf4d623cc1d","target_version":"5.2.4"},{"affected_status":"unaffected","availability":"available","compatibility":"compatible","source_key":"option-source-ad8a68597117","target_version":"6.2.3"},{"affected_status":"unaffected","availability":"available","compatibility":"incompatible","source_key":"option-source-3837103bd544","target_version":"7.5.10"},{"affected_status":"unaffected","availability":"available","compatibility":"incompatible","source_key":"option-source-21ea6628adfc","target_version":"8.17.1"}],"source_key":"finding-source-6f118f32ec11"},{"advisories":[{"advisory_id":"GHSA-4w2j-2rg4-5mjw","severity":"critical"}],"affected_status":"affected","dependency_paths":[{"package_chain":["npm:fixture-root-r01@1.0.0","npm:vm2@3.9.9"],"relationship":"direct","runtime_scope":"production","source_key":"path-source-487071b3cdc9"}],"ecosystem":"npm","evidence_references":[{"snippet":"vm2 vulnerable to Arbitrary Code Execution","source_key":"evidence-source-76a737633da5","subject_key":"finding-source-af0e91645836","subject_type":"finding"}],"installed_version":"3.9.9","package_name":"vm2","reachability":"reachable","remediation_options":[{"affected_status":"unaffected","availability":"available","compatibility":"compatible","source_key":"option-source-59031e9adaf4","target_version":"3.9.10"}],"source_key":"finding-source-af0e91645836"},{"advisories":[{"advisory_id":"GHSA-3h5v-q93c-6h6q","severity":"high"}],"affected_status":"unaffected","dependency_paths":[{"package_chain":["npm:fixture-root-r01@1.0.0","npm:ws@5.2.4"],"relationship":"direct","runtime_scope":"development_only","source_key":"path-source-5dbf3e388c57"}],"ecosystem":"npm","evidence_references":[{"snippet":"ws affected by a DoS when handling a request with many HTTP headers","source_key":"evidence-source-5b18023efade","subject_key":"finding-source-dbadf4391f31","subject_type":"finding"}],"installed_version":"5.2.4","package_name":"ws","reachability":"reachable","remediation_options":[{"affected_status":"unaffected","availability":"available","compatibility":"compatible","source_key":"option-source-50abdb68d137","target_version":"5.2.4"},{"affected_status":"unaffected","availability":"available","compatibility":"incompatible","source_key":"option-source-78e56718ce68","target_version":"6.2.3"},{"affected_status":"unaffected","availability":"available","compatibility":"incompatible","source_key":"option-source-f3456231cac1","target_version":"7.5.10"},{"affected_status":"unaffected","availability":"available","compatibility":"incompatible","source_key":"option-source-07b91db4c915","target_version":"8.17.1"}],"source_key":"finding-source-dbadf4391f31"}],"schema_version":1,"split":"regression","task_id":"dependency-3c80f2a592fb"}
