{"family_id":"family-r02","fixture_id":"dp-regression-02","normalized_findings":[{"advisories":[{"advisory_id":"GHSA-fjxv-7rqg-78g4","severity":"critical"}],"affected_status":"affected","dependency_paths":[{"package_chain":["npm:fixture-root-r02@1.0.0","npm:form-data@3.0.3"],"relationship":"direct","runtime_scope":"production","source_key":"path-source-e95cfe660cee"}],"ecosystem":"npm","evidence_references":[{"snippet":"form-data uses unsafe random function in form-data for choosing boundary","source_key":"evidence-source-466371096ef9","subject_key":"finding-source-c94ebc9e1ea7","subject_type":"finding"}],"installed_version":"3.0.3","package_name":"form-data","reachability":"reachable","remediation_options":[{"affected_status":"unaffected","availability":"available","compatibility":"incompatible","source_key":"option-source-71cd5fb3cb12","target_version":"2.5.4"},{"affected_status":"unaffected","availability":"available","compatibility":"compatible","source_key":"option-source-cc38d8d1bb3e","target_version":"3.0.4"},{"affected_status":"unaffected","availability":"available","compatibility":"incompatible","source_key":"option-source-7e8f5ec57764","target_version":"4.0.4"}],"source_key":"finding-source-c94ebc9e1ea7"},{"advisories":[{"advisory_id":"GHSA-fjxv-7rqg-78g4","severity":"critical"}],"affected_status":"unaffected","dependency_paths":[{"package_chain":["npm:fixture-root-r02@1.0.0","npm:form-data@2.5.4"],"relationship":"direct","runtime_scope":"development_only","source_key":"path-source-5efc30c684ff"}],"ecosystem":"npm","evidence_references":[{"snippet":"form-data uses unsafe random function in form-data for choosing boundary","source_key":"evidence-source-e56f6607cdcf","subject_key":"finding-source-f74e3ba8e712","subject_type":"finding"}],"installed_version":"2.5.4","package_name":"form-data","reachability":"reachable","remediation_options":[{"affected_status":"unaffected","availability":"available","compatibility":"compatible","source_key":"option-source-03e34c7f4e26","target_version":"2.5.4"},{"affected_status":"unaffected","availability":"available","compatibility":"incompatible","source_key":"option-source-23422442df56","target_version":"3.0.4"},{"affected_status":"unaffected","availability":"available","compatibility":"incompatible","source_key":"option-source-65729b70a18c","target_version":"4.0.4"}],"source_key":"finding-source-f74e3ba8e712"}],"schema_version":1,"split":"regression","task_id":"dependency-6d6d3443e35e"}
