{"family_id":"family-d05","fixture_id":"dp-development-05","normalized_findings":[{"advisories":[{"advisory_id":"GHSA-qwph-4952-7xr6","severity":"moderate"}],"affected_status":"affected","dependency_paths":[{"package_chain":["npm:fixture-root-d05@1.0.0","npm:jsonwebtoken@8.5.1"],"relationship":"direct","runtime_scope":"production","source_key":"path-source-799ba5b86e51"}],"ecosystem":"npm","evidence_references":[{"snippet":"jsonwebtoken vulnerable to signature validation bypass due to insecure default algorithm in jwt.verify()","source_key":"evidence-source-0630dee72b50","subject_key":"finding-source-b44e53226c86","subject_type":"finding"}],"installed_version":"8.5.1","package_name":"jsonwebtoken","reachability":"reachable","remediation_options":[{"affected_status":"unaffected","availability":"available","compatibility":"incompatible","source_key":"option-source-3feca011f8d5","target_version":"9.0.0"}],"source_key":"finding-source-b44e53226c86"}],"schema_version":1,"split":"development","task_id":"dependency-438dc9cbb5b3"}
