{"family_id":"family-d06","fixture_id":"dp-development-06","normalized_findings":[{"advisories":[{"advisory_id":"PYSEC-2026-1873","severity":"moderate"}],"affected_status":"affected","dependency_paths":[{"package_chain":["pypi:fixture-root-d06@1.0.0","pypi:requests@2.31.0"],"relationship":"direct","runtime_scope":"production","source_key":"path-source-589e9a2ec6e8"}],"ecosystem":"pypi","evidence_references":[{"snippet":"Requests `Session` object does not verify requests after making first request with verify=False","source_key":"evidence-source-7153a66c9ea1","subject_key":"finding-source-21b50a5db27e","subject_type":"finding"}],"installed_version":"2.31.0","package_name":"requests","reachability":"unknown","remediation_options":[{"affected_status":"unaffected","availability":"available","compatibility":"compatible","source_key":"option-source-300df1783061","target_version":"2.32.0"}],"source_key":"finding-source-21b50a5db27e"},{"advisories":[{"advisory_id":"PYSEC-2023-212","severity":"moderate"}],"affected_status":"affected","dependency_paths":[{"package_chain":["pypi:fixture-root-d06@1.0.0","pypi:requests@2.31.0","pypi:urllib3@1.26.17"],"relationship":"transitive","runtime_scope":"production","source_key":"path-source-07c622fb2496"}],"ecosystem":"pypi","evidence_references":[{"snippet":"urllib3 is a user-friendly HTTP client library for Python. urllib3 previously wouldn't remove the HTTP request body when an HTTP redirect response using status 301, 302, or 303 after the request had its method changed from one that could accept a request body (like `POST`) to `GET` as is required by HTTP RFCs. Although this behavior is not specified in the section for redirects, it can be inferred by piecing together information from different sections and we have observed the behavior in other major HTTP client implementations like curl and web browsers. Because the vulnerability requires a p","source_key":"evidence-source-bdd7dc2aee24","subject_key":"finding-source-5dd1421fbc2f","subject_type":"finding"}],"installed_version":"1.26.17","package_name":"urllib3","reachability":"reachable","remediation_options":[{"affected_status":"unaffected","availability":"available","compatibility":"compatible","source_key":"option-source-5d747604bb77","target_version":"1.26.18"},{"affected_status":"unaffected","availability":"available","compatibility":"incompatible","source_key":"option-source-3bff14db9253","target_version":"2.0.7"}],"source_key":"finding-source-5dd1421fbc2f"}],"schema_version":1,"split":"development","task_id":"dependency-ac6358ea9c77"}
