{"family_id":"family-d08","fixture_id":"dp-development-08","normalized_findings":[{"advisories":[{"advisory_id":"PYSEC-2023-254","severity":"high"}],"affected_status":"affected","dependency_paths":[{"package_chain":["pypi:fixture-root-d08@1.0.0","pypi:fixture-helper-d08@1.0.0","pypi:cryptography@41.0.5"],"relationship":"transitive","runtime_scope":"production","source_key":"path-source-6efc97fe160b"}],"ecosystem":"pypi","evidence_references":[{"snippet":"cryptography is a package designed to expose cryptographic primitives and recipes to Python developers. Calling `load_pem_pkcs7_certificates` or `load_der_pkcs7_certificates` could lead to a NULL-pointer dereference and segfault. Exploitation of this vulnerability poses a serious risk of Denial of Service (DoS) for any application attempting to deserialize a PKCS7 blob/certificate. The consequences extend to potential disruptions in system availability and stability. This vulnerability has been patched in version 41.0.6.","source_key":"evidence-source-f6fd6032c7f1","subject_key":"finding-source-a9a1e416f702","subject_type":"finding"}],"installed_version":"41.0.5","package_name":"cryptography","reachability":"unreachable","remediation_options":[{"affected_status":"unaffected","availability":"available","compatibility":"incompatible","source_key":"option-source-b392b308b2d6","target_version":"41.0.6"}],"source_key":"finding-source-a9a1e416f702"}],"schema_version":1,"split":"development","task_id":"dependency-e3fceb0dc80d"}
