{"family_id":"family-r03","fixture_id":"dp-regression-03","normalized_findings":[{"advisories":[{"advisory_id":"PYSEC-2026-2222","severity":"high"}],"affected_status":"affected","dependency_paths":[{"package_chain":["pypi:fixture-root-r03@1.0.0","pypi:mlflow@3.10.0"],"relationship":"direct","runtime_scope":"production","source_key":"path-source-68a148bbe98e"}],"ecosystem":"pypi","evidence_references":[{"snippet":"A vulnerability in mlflow/mlflow versions prior to 3.11.0 allows for the resolution of environment variables in AI Gateway secrets, which can be exploited to exfiltrate sensitive server-side environment credentials to an attacker-controlled endpoint. This issue arises because the `api_key` field in gateway secrets can accept `$ENV_VAR` references, which are resolved against the MLflow server's environment during runtime. The resolved secrets are then sent in provider authentication headers to the configured upstream `api_base`. This vulnerability can be exploited by low-privileged authenticate","source_key":"evidence-source-cbbf6d2f78ee","subject_key":"finding-source-0cc52ec839c1","subject_type":"finding"}],"installed_version":"3.10.0","package_name":"mlflow","reachability":"unknown","remediation_options":[{"affected_status":"unaffected","availability":"available","compatibility":"compatible","source_key":"option-source-0ed7e91b2f57","target_version":"3.11.0"}],"source_key":"finding-source-0cc52ec839c1"},{"advisories":[{"advisory_id":"PYSEC-2026-1473","severity":"moderate"}],"affected_status":"affected","dependency_paths":[{"package_chain":["pypi:fixture-root-r03@1.0.0","pypi:fixture-helper-r03@1.0.0","pypi:jinja2@3.1.2"],"relationship":"transitive","runtime_scope":"production","source_key":"path-source-0529890c3a4b"},{"package_chain":["pypi:fixture-root-r03@1.0.0","pypi:fixture-helper-r03-b@1.0.0","pypi:jinja2@3.1.2"],"relationship":"transitive","runtime_scope":"production","source_key":"path-source-46667ff54170"}],"ecosystem":"pypi","evidence_references":[{"snippet":"Jinja vulnerable to HTML attribute injection when passing user input as keys to xmlattr filter","source_key":"evidence-source-8429bb9c72f9","subject_key":"finding-source-6e03185a0a7d","subject_type":"finding"}],"installed_version":"3.1.2","package_name":"jinja2","reachability":"reachable","remediation_options":[{"affected_status":"unaffected","availability":"available","compatibility":"incompatible","source_key":"option-source-82c82ad0f4d7","target_version":"3.1.3"}],"source_key":"finding-source-6e03185a0a7d"}],"schema_version":1,"split":"regression","task_id":"dependency-5aba9940e480"}
