{"family_id":"family-s05","fixture_id":"dp-sealed-05","normalized_findings":[{"advisories":[{"advisory_id":"PYSEC-2026-226","severity":"critical"}],"affected_status":"affected","dependency_paths":[{"package_chain":["pypi:fixture-root-s05@1.0.0","pypi:fixture-helper-s05@1.0.0","pypi:vllm@0.21.0"],"relationship":"transitive","runtime_scope":"production","source_key":"path-source-9d2d000330e6"}],"ecosystem":"pypi","evidence_references":[{"snippet":"vLLM is an inference and serving engine for large language models (LLMs). From 0.3.0 until 0.22.0, a vulnerability in ASGI web servers and starlette's trust on those web servers enables an authentication bypass of the OpenAI API AuthenticationMiddleware. It allows to use the API without providing the configured VLLM_API_KEY or --api-key. This vulnerability is fixed in 0.22.0.","source_key":"evidence-source-f370faa0c2a0","subject_key":"finding-source-be5b8ea10634","subject_type":"finding"}],"installed_version":"0.21.0","package_name":"vllm","reachability":"reachable","remediation_options":[{"affected_status":"unaffected","availability":"available","compatibility":"compatible","source_key":"option-source-3df767fb7f5f","target_version":"0.22.0"}],"source_key":"finding-source-be5b8ea10634"}],"schema_version":1,"split":"sealed","task_id":"dependency-a8e5a4468a72"}
