{"family_id":"family-s03","fixture_id":"dp-sealed-03","normalized_findings":[{"advisories":[{"advisory_id":"GHSA-rg76-677x-56q9","severity":"critical"}],"affected_status":"unaffected","dependency_paths":[{"package_chain":["npm:fixture-root-s03@1.0.0","npm:crypto-js@4.0.0"],"relationship":"direct","runtime_scope":"production","source_key":"path-source-f9e76365112d"}],"ecosystem":"npm","evidence_references":[{"snippet":"crypto-js: Insufficient Entropy in Cryptographic Secret Generation via Vulnerable CryptoJS Dependency Chain","source_key":"evidence-source-243d13aae9fd","subject_key":"finding-source-13ffd079a81f","subject_type":"finding"}],"installed_version":"4.0.0","package_name":"crypto-js","reachability":"reachable","remediation_options":[{"affected_status":"unaffected","availability":"available","compatibility":"compatible","source_key":"option-source-488242c423e6","target_version":"4.0.0"}],"source_key":"finding-source-13ffd079a81f"},{"advisories":[{"advisory_id":"GHSA-rg76-677x-56q9","severity":"critical"}],"affected_status":"affected","dependency_paths":[{"package_chain":["npm:fixture-root-s03@1.0.0","npm:crypto-js@3.3.0"],"relationship":"direct","runtime_scope":"development_only","source_key":"path-source-c345988e53d4"}],"ecosystem":"npm","evidence_references":[{"snippet":"crypto-js: Insufficient Entropy in Cryptographic Secret Generation via Vulnerable CryptoJS Dependency Chain","source_key":"evidence-source-cb08047ec35b","subject_key":"finding-source-b9096c9d21ee","subject_type":"finding"}],"installed_version":"3.3.0","package_name":"crypto-js","reachability":"unreachable","remediation_options":[{"affected_status":"unaffected","availability":"available","compatibility":"incompatible","source_key":"option-source-6b2709dabe04","target_version":"4.0.0"}],"source_key":"finding-source-b9096c9d21ee"}],"schema_version":1,"split":"sealed","task_id":"dependency-28aebe347c83"}
